7. Read Captured Packets File
# tcpdump -r 0001.pcap

root@comp3134-winter-2022-intro-to-cyber-security:~# tcpdump -r 0001.pcap
reading from file 0001.pcap, link-type EN10MB (Ethernet)
21:30:10.383172 IP comp3134-winter-2022-intro-to-cyber-security.ssh > cpe688f2e1ca513-cm688f2e1ca510.cpe.net.cable.rogers.com.51482: Flags [P.], seq 2973121161:2973121205, ack 2047509717, win 501, length 44
21:30:10.383379 IP comp3134-winter-2022-intro-to-cyber-security.ssh > cpe688f2e1ca513-cm688f2e1ca510.cpe.net.cable.rogers.com.51482: Flags [P.], seq 44:152, ack 1, win 501, length 108
21:30:10.383519 IP comp3134-winter-2022-intro-to-cyber-security.ssh > cpe688f2e1ca513-cm688f2e1ca510.cpe.net.cable.rogers.com.51482: Flags [P.], seq 152:188, ack 1, win 501, length 36
21:30:10.395361 IP cpe688f2e1ca513-cm688f2e1ca510.cpe.net.cable.rogers.com.51482 > comp3134-winter-2022-intro-to-cyber-security.ssh: Flags [.], ack 188, win 4101, length 0
21:30:12.485233 IP comp3134-winter-2022-intro-to-cyber-security.ssh > 85-220-90-13.dsl.dynamic.simnet.is.52334: Flags [P.], seq 1473448907:1473448959, ack 3609664100, win 502, options [nop,nop,TS val 3975536312 ecr 10295477], length 52
21:30:12.606655 IP 85-220-90-13.dsl.dynamic.simnet.is.52334 > comp3134-winter-2022-intro-to-cyber-security.ssh: Flags [.], ack 52, win 295, options [nop,nop,TS val 10304637 ecr 3975536312,nop,nop,sack 1 {0:52}], length 0
21:30:12.606720 IP comp3134-winter-2022-intro-to-cyber-security > 85-220-90-13.dsl.dynamic.simnet.is: ICMP comp3134-winter-2022-intro-to-cyber-security tcp port ssh unreachable, length 72
21:30:16.403315 IP comp3134-winter-2022-intro-to-cyber-security.ssh > 112.85.42.87.29559: Flags [F.], seq 627683740, ack 1695565000, win 510, options [nop,nop,TS val 3665074576 ecr 2108312], length 0
21:30:16.635261 IP 112.85.42.87.29559 > comp3134-winter-2022-intro-to-cyber-security.ssh: Flags [R], seq 1695565000, win 0, length 0
21:30:16.635338 IP comp3134-winter-2022-intro-to-cyber-security > 112.85.42.87: ICMP comp3134-winter-2022-intro-to-cyber-security tcp port ssh unreachable, length 48
21:30:17.093193 IP comp3134-winter-2022-intro-to-cyber-security.ssh > 112.85.42.87.29559: Flags [F.], seq 0, ack 1, win 510, options [nop,nop,TS val 3665075266 ecr 2108312], length 0
21:30:17.323609 IP 112.85.42.87.29559 > comp3134-winter-2022-intro-to-cyber-security.ssh: Flags [R], seq 1695565000, win 0, length 0
21:30:17.323685 IP comp3134-winter-2022-intro-to-cyber-security > 112.85.42.87: ICMP comp3134-winter-2022-intro-to-cyber-security tcp port ssh unreachable, length 48
